,coin_int_id,source,author,title,description,url,publishedAt
574,7,Coinspeaker,Ibrahim Ajibade,Solana Memecoin Popcat Sees 500% Volume Surge Amid Hyperliquid DEX Manipulation Claims,Solana-based memecoin Popcat POPCAT $0.11 24h volatility: 5.8% Market cap: $113.33 M Vol. 24h: $64.92 M recorded a 500% increase in trading volume on Nov. 12...,https://www.coinspeaker.com/popcat-memecoin-500-percent-volume-spike-manipulation-allegations/,2025-11-12T21:06:31Z
575,7,TheStreet,Scott Melker,"Upexi CEO says Solana staking fueled 183% profit surge, calls it 'the future of financial rails'","Allan Marshall, CEO of Upexi Inc. (Nasdaq: UPXI), credited Solana (SOL) staking income for driving the company’s 183% year-on-year profit surge in the last...",https://www.thestreet.com/crypto/markets/upexi-ceo-says-solana-staking-fueled-183-profit-surge,2025-11-13T01:02:22Z
576,7,Dlnews.com,Osato Avan-Nomayo,Cardano whales scoop up $200m of ADA despite ETF freeze,"Almost 1% of the Cardano supply was bought by whales in the last week. No word on SEC approval for Cardano ETF. Cardano outperformed Bitcoin, Solana, and XRP...",https://www.dlnews.com/articles/markets/cardano-whales-scoop-up-200m-in-ada-despite-etf-freeze/,2025-11-11T13:57:11Z
577,7,Cointelegraph,Cointelegraph by Zoltan Vardai,"Crypto’s yield gap with TradFi narrows as staking, RWAs surge","Crypto faces a five-fold gap in yield-bearing products compared to TradFi, but RWAs, staking tokens and stablecoins are bridging this gap, catalyzed by clarity from the GENIUS Act.",https://cointelegraph.com/news/crypto-yield-gap-narrows-defi-rwas-staking,2025-11-12T15:00:00Z
578,7,Cointelegraph,Cointelegraph by Nancy Lubale,3 SOL data points suggest $130 was the bottom: Is it time for a return to range highs?,Charts and onchain data suggest that SOL might have bottomed at $130. Should traders anticipate a rally back to $200?,https://cointelegraph.com/news/3-sol-data-points-suggest-dollar130-was-the-bottom-is-it-time-for-a-return-to-range-highs,2025-11-18T21:58:51Z
579,7,Cointelegraph,Cointelegraph by Helen Partz,Crypto funds post second week of outflows as altcoins buck the trend,"After two consecutive weeks of outflows totaling $1.5 billion, assets under management in crypto ETPs fell to $207.5 billion, the lowest level since mid-July.",https://cointelegraph.com/news/crypto-etf-second-week-outflows-altcoins-defy-trend-coinshares,2025-11-10T11:20:00Z
580,7,Cointelegraph,Cointelegraph by Zoltan Vardai,Bitcoin ETFs bleed $1.1B as analysts warn of ‘mini’ bear market at pivotal moment,"Bitcoin ETFs saw $1.1 billion worth of outflows last week, triggering analyst calls for a “mini” bear market that opens the door for a pivotal moment for cryptocurrency markets.",https://cointelegraph.com/news/bitcoin-etf-outflows-1-1b-mini-bear-market-fears,2025-11-17T09:08:24Z
581,7,Cointelegraph,Cointelegraph by Amin Haqshanas,Average Bitcoin ETF investor now underwater as BTC falls below $89.6K,"Bitcoin’s drop below $89,600 has pushed the average spot Bitcoin ETF investor into losses for the first time, as BTC and ETH products extend a multiday streak of heavy outflows.",https://cointelegraph.com/news/bitcoin-etf-investors-underwater-btc-drops-below-89600,2025-11-18T07:43:32Z
582,7,Prtimes.jp,,ERPC が Backpack『Best Solana RPC Providers 2025』にてベスト5に選出,"[ELSOUL LABO B.V.]
[画像1: https://prcdn.freetls.fastly.net/release_image/105962/307/105962-307-86982ff464049066cf1168e74408fe11-2400x1260.jpg?width=536&quality=85%2C75&format=jpeg&auto=webp&fit=bound...",https://prtimes.jp/main/html/rd/p/000000307.000105962.html,2025-11-14T16:03:10Z
583,7,Prtimes.jp,,ERPC、東京リージョンに大型ハイパフォーマンス Solana RPC ノードを追加。アジア全域の性能と安定性を強化,"[ELSOUL LABO B.V.]
[画像1: https://prcdn.freetls.fastly.net/release_image/105962/305/105962-305-1925087a727c87b04a50f793492e74b5-2400x1260.jpg?width=536&quality=85%2C75&format=jpeg&auto=webp&fit=bound...",https://prtimes.jp/main/html/rd/p/000000305.000105962.html,2025-11-12T05:30:14Z
584,7,Prtimes.jp,,ERPC、Solana バリデータ・gRPCノード向けコストパフォーマンスベアメタルサーバーをフランクフルトで数量限定再入荷,"[ELSOUL LABO B.V.]
[画像1: https://prcdn.freetls.fastly.net/release_image/105962/303/105962-303-04f73a485237fbb60846221d7aa49bba-2400x1260.jpg?width=536&quality=85%2C75&format=jpeg&auto=webp&fit=bound...",https://prtimes.jp/main/html/rd/p/000000303.000105962.html,2025-11-11T00:40:03Z
585,7,CoinDesk,"Siamak Masnavi, AI Boost","Bitcoin Falls Below $94,000 for First Time Since May Amid 'Extreme Fear' Sentiment","Analysts highlighted retail distress, rare social-dominance surges and warnings of a possible deeper pullback as several major tokens remained under pressure.",https://www.coindesk.com/markets/2025/11/16/bitcoin-falls-below-usd94-000-for-first-time-since-may-amid-extreme-fear-sentiment,2025-11-16T18:49:34Z
586,7,CoinDesk,"Krisztian Sandor, AI Boost",Crypto Wallet Exodus Acquiring Grateful to Expand Stablecoin Payments in Latin America,The deal will add stablecoin-based payment tools for merchants and gig workers as crypto payments are rapidly growing.,https://www.coindesk.com/business/2025/11/10/crypto-wallet-exodus-acquiring-grateful-to-expand-stablecoin-payments-in-latin-america,2025-11-10T18:11:58Z
587,7,CoinDesk,Krisztian Sandor,"Bitcoin Plunges Below $102K Amid Weak U.S. Demand, Fed Divided on December Cut","Bitcoin's Coinbase Premium, a popular gauge for U.S. demand, is having its longest negative streak since the April correction, coinciding with the Fed turning more hawkish.",https://www.coindesk.com/markets/2025/11/12/bitcoin-plunges-below-usd102k-amid-weak-u-s-demand-fed-divided-on-december-cut,2025-11-12T17:33:45Z
588,7,Yahoo Entertainment,Hannah Lang,"Crypto treasury companies pivot to fringe tokens, stoking volatility fears","(Reuters) -As companies focused on stockpiling bitcoin and other major cryptocurrencies come under pressure amid market saturation and souring sentiment, new...",https://finance.yahoo.com/news/crypto-treasury-companies-pivot-fringe-110217246.html,2025-11-10T11:02:17Z
589,7,BeInCrypto,Nhat Hoang,How Grayscale Holds XLM as the Price Drops More Than 50%,"Grayscale XLM holdings stay firm as prices drop, with GXLM premiums and Stellar’s RWA and payments growth shaping 2026 demand.",https://beincrypto.com/how-grayscale-holds-xlm-as-the-price-drops/,2025-11-14T10:19:25Z
590,7,Cryptonews,Sujha Sundararajan,Canary Capital to Launch First Memecoin ETF to Track Price of MOG Coin,"Crypto fund manager Canary Capital has filed to launch the first U.S. exchange-traded fund (ETF) tied directly to MOG Coin, a memecoin on the Ethereum...",https://cryptonews.com/news/canary-capital-to-launch-first-memecoin-etf-to-track-price-of-mog-coin/,2025-11-13T01:47:47Z
591,7,Coinspeaker,Godfrey Benjamin,Crypto Funds Bled $2 Billion as Bitcoin and Ethereum Selloff Continues,"Digital asset investment products recorded up to $2 billion in outflows last week. According to CoinShares, this massive outflow was triggered by monetary...",https://www.coinspeaker.com/crypto-funds-bled-2-billion-as-bitcoin-and-ethereum-selloff-continues/,2025-11-17T13:35:23Z
592,7,BeInCrypto,Shigeki Mori,USDC Payroll Goes Mainstream: Paystand Acquires Bitwage,"Paystand acquires Bitwage, adding crypto payroll with USDC/USDT to $20B platform as stablecoin transfers hit $9T in 2025.",https://beincrypto.com/usdc-payroll-goes-mainstream-paystand-acquires-bitwage/,2025-11-11T09:44:42Z
593,7,Yahoo Entertainment,Jeff John Roberts,Investing app Public acquires crypto IRA business for $65 million,The deal will make the brokerage the first to offer a wide range of crypto assets for retirement accounts.,https://finance.yahoo.com/news/investing-app-public-acquires-crypto-150000156.html,2025-11-13T15:00:00Z
594,7,TheStreet,Anand Sinha,James Altucher-linked stock surges 400% ahead of earnings today,"Nuvve Holding Corp. (Nasdaq: NVVE) is a global leader in grid modernization and vehicle-to-grid (V2G) technology. The company, with plans to create a crypto ...",https://www.thestreet.com/crypto/trading/james-altucher-stock-earnings,2025-11-13T20:58:58Z
595,7,Coinspeaker,Zoran Spirkovski,"SGX to Launch Bitcoin, Ethereum Perpetual Futures on Nov 24",Singapore Exchange Derivatives will launch Bitcoin BTC $91 937 24h volatility: 3.2% Market cap: $1.83 T Vol. 24h: $124.12 B and Ethereum ETH $3 070 24h...,https://www.coinspeaker.com/sgx-to-launch-bitcoin-ethereum-perpetual-futures-on-nov-24/,2025-11-17T14:18:07Z
596,7,Coinspeaker,Bhushan Akolkar,Cathie Wood Buys $10M in Bullish (BLSH) Stock Ahead of Q3 Results,Ark Invest CEO Cathie Wood made a bold move by buying nearly $10 million worth of stocks of crypto exchange Bullish (BLSH). This purchase on November 17...,https://www.coinspeaker.com/cathie-wood-buys-10m-in-bullish-blsh-stock-ahead-of-q3-results/,2025-11-18T12:56:48Z
597,7,BeInCrypto,Oluwapelumi Adejumo,XRP Profit Taking Climbs to $220 Million Amid Price Retreat,"XRP is under mounting pressure as long-term holders accelerate profit taking, realizing roughly $220 million per day.",https://beincrypto.com/xrp-profit-taking-amid-market-decline/,2025-11-09T13:02:57Z
598,7,Coinspeaker,Zoran Spirkovski,SEC Chair Atkins Proposes Token Taxonomy to Limit Perpetual Securities Status,SEC Chairman Paul Atkins proposed a token classification framework on Nov. 12 that outlines how digital assets can transition out of securities status once...,https://www.coinspeaker.com/sec-token-classification-framework-decentralization/,2025-11-12T20:02:05Z
599,8,Yahoo Entertainment,Daniel Phillips,"AI News: Market Sell-Off Smashes AI Tokens, Few Show Strength",The AI sector suffered a significant drawdown this week. The sector’s market capitalization (mcap) fell 18.7% to reach $24.2 billion—a figure not seen since ...,https://finance.yahoo.com/news/ai-news-market-sell-off-165820620.html,2025-11-17T16:58:20Z
600,8,Hackaday,Bryan Cockfield,Kubernetes Cluster Goes Mobile in Pet Carrier,"There’s been a bit of a virtualization revolution going on for the last decade or so, where tools like Docker and LXC have made it possible to quickly deploy server applications without worry…",https://hackaday.com/2025/11/18/kubernetes-cluster-goes-mobile-in-pet-carrier/,2025-11-19T03:00:13Z
601,8,TheStreet,Pooja Rajkumari,Billionaire Arthur Hayes dumps $2.4M over weekend,"Crypto billionaire Arthur Hayes has sold millions of dollars’ worth of digital assets, according to on-chain analysts, in what they describe as a significant...",https://www.thestreet.com/crypto/trading/billionaire-arthur-hayes-dumps-2-4m-over-weekend,2025-11-17T19:43:58Z
602,8,Kotaku,Kotaku Deals,"This Official 20W USB-C Charger for iPhone Sells for Pennies, and It Includes a 5-Foot Cable","This 20W dual-port charger bundle includes two adapters plus two 5-foot USB-C cables, and it's selling for nothing.
The post This Official 20W USB-C Charger for iPhone Sells for Pennies, and It Includes a 5-Foot Cable appeared first on Kotaku.",https://kotaku.com/this-official-20w-usb-c-charger-for-iphone-sells-for-pennies-and-it-includes-a-5-foot-cable-2000642458,2025-11-10T17:45:06Z
603,8,The Verge,Jay Peters,The Steam Frame is a surprising new twist on VR,"Valve is about to launch a new virtual reality headset, and with it, a comprehensive new approach to what a VR device should be. Most VR headsets I've tried have ended up collecting dust after the novelty wore off, and I thought I had sworn off VR for good. B…",https://www.theverge.com/games/816118/valve-steam-frame-vr-headset-streaming-arm-steamos-hands-on,2025-11-12T17:54:45Z
604,8,BGR,staff@bgr.com (José Adorno),Mophie Launches Juice Pack Battery Cases For iPhone Air And iPhone 17 Pro Models,The Mophie Juice Pack battery case can provide up to 50% of additional power to your iPhone 17 Pro and 60% to the iPhone Air when you're out and about.,https://www.bgr.com/2023306/mophie-juice-pack-battery-case-iphone-17/,2025-11-11T14:47:10Z
605,8,CoinDesk,Omkar Godbole,Tether Dominance Surges to Highest Since April. What Does it Mean?,Tether becomes more dominance as BTC loses ground.,https://www.coindesk.com/markets/2025/11/14/tether-dominance-surges-to-highest-since-april,2025-11-14T05:21:33Z
606,8,Biztoc.com,finance.yahoo.com,Tether unloads 20%of its stake in bitcoin miner Bitdeer,"Stablecoin issuer Tether has trimmed its holdings in Bitcoin miner and AI data center firm Bitdeer (Nasdaq: BTDR) by some 7.7 million shares for $166 million in gross earnings since the April peak holding, recent filings show.
The reduction follows a series o…",https://biztoc.com/x/3479ce324d8a8afb,2025-11-11T16:57:32Z
607,8,Biztoc.com,theblock.co,DOJ says US citizens helped North Korean IT workers infiltrate 136 companies,The DOJ seized $15 million in Tether in order to return the funds to their rightful owners as part of an ongoing campaign against North Korean hackers.,https://biztoc.com/x/c186904d94f27e3e,2025-11-15T22:53:26Z
608,8,Pitchfork,"Nina Corcoran, Ryan Kincaid, Matthew Strauss","Geese, Turnstile, Oklou, and More Releasing Rough Trade Exclusive Vinyl Records","Bon Iver, Clipse, Hayley Williams, Viagra Boys, and others are also issuing special-edition records",https://pitchfork.com/news/geese-turnstile-oklou-releasing-rough-trade-exclusive-vinyl-records/,2025-11-11T15:48:38Z
609,8,Yanko Design,Sarang Sheth,The Best Travel Bags Under $100 Are Made From Recycled Materials,"The Best Travel Bags Under $100 Are Made From Recycled MaterialsFor decades, the gospel of good design was chanted in a simple two-part harmony: form and function. An object had to look good, and it...",https://www.yankodesign.com/2025/11/13/the-best-travel-bags-under-100-are-made-from-recycled-materials/,2025-11-14T02:45:17Z
610,8,CoinDesk,"James Van Straten, AI Boost","Rumble Shares Soar on Tether Partnerships , Planned Northern Data Acquisition","Rumble unveiled three major deals with Tether and Northern Data, expanding its AI infrastructure, ad business and cloud capacity.",https://www.coindesk.com/markets/2025/11/10/rumble-shares-soar-on-tether-partnerships-planned-northern-data-acquisition,2025-11-10T12:30:16Z
611,8,Blockspace.media,Blockspace Staff,Tether unloads 20%of its stake in bitcoin miner Bitdeer,"Tether sold shares for an average of $21.58 over the course of September and October, filings show.",https://blockspace.media/insight/tether-unloads-20of-its-stake-in-bitcoin-miner-bitdeer/,2025-11-11T16:26:32Z
612,8,New Atlas,Abhimanyu Ghoshal,Valve's new VR gaming headset packs a clever high-res graphics feature,"Valve – which runs the Steam game store and made the legendary Half-Life series – already makes a VR headset for hardcore gamers who care to tether themselves to a beefy PC for an immersive experience. Its new headset, the Steam Frame, is designed to make VR …",https://newatlas.com/vr/valve-vr-gaming-headset-steam-frame-foveated-streaming/,2025-11-13T13:09:05Z
613,8,CoinDesk,"Francisco Rodrigues, AI Boost",Tether Eyes $1B Investment in German Robotics Startup Neura: FT,Neura aims to produce 5 million robots by 2030 and has already booked €1 billion in orders.,https://www.coindesk.com/business/2025/11/15/tether-eyes-usd1b-investment-in-german-robotics-startup-neura-ft,2025-11-15T16:32:37Z
614,8,Coinspeaker,Ibrahim Ajibade,Tether Appoints Senior HSBC Metals Traders to Advance Gold Portfolio,"Tether, the world’s largest stablecoin issuer, hired senior metals traders from HSBC to oversee the expansion of its gold reserves and precious metals...",https://www.coinspeaker.com/tether-hires-hsbc-metals-traders-gold-reserves/,2025-11-11T20:12:54Z
615,8,CoinDesk,CoinDesk,Rumble Shares Soar on AI Acquisition Plans; $250M Commitment from Tether,Rumble stock is soaring after announcing a deal to buy AI firm Northern Data AG. The move is backed by a massive $250 million commitment from Tether. What...,https://videos.coindesk.com/previews/xphVAjKG,2025-11-10T17:30:50Z
616,8,GameSpot,Richard Wakeling,Ambrosia Sky: Act One Review - Deep Space Burial,"Metroid Prime meets PowerWash Simulator is the elevator pitch for Ambrosia Sky: Act One. Set aboard a derelict space colony within the rings of Saturn, you'll explore the apartments, science labs, and interstellar farms of this once-thriving community, readin…",https://www.gamespot.com/reviews/ambrosia-sky-act-one-review-deep-space-burial/1900-6418440/,2025-11-13T20:44:00Z
617,8,CoinDesk,"Jamie Crawley, AI Boost",Tether Invests in Ledn to Expand Bitcoin-Backed Lending Amid Surging Demand,"The stablecoin issuer's investment comes as BTC-backed lending scales rapidly, with Ledn surpassing $1 billion in originations this year and positioning for global expansion.",https://www.coindesk.com/business/2025/11/18/tether-invests-in-ledn-to-expand-bitcoin-backed-lending-eyeing-surging-demand,2025-11-18T13:05:59Z
618,8,CoinDesk,"Will Canny, AI Boost",Northern Data Cut to Hold to Reflect Acquisition by Rumble: Canaccord,The broker downgraded Northern Data to hold from buy and lowered its price target to 15 euros from 27 euros.,https://www.coindesk.com/business/2025/11/11/northern-data-cut-to-hold-to-reflect-acquisition-by-rumble-canaccord,2025-11-11T09:12:27Z
619,8,Biztoc.com,ft.com,Merck nears $9.2bn deal for flu-prevention biotech Cidara,,https://biztoc.com/x/d3348362a30a62b7,2025-11-14T12:27:27Z
620,8,Biztoc.com,bloomberg.com,Airline Stocks Face Murky Outlook Following Record US Shutdown,,https://biztoc.com/x/37d69a7cdab8fb1c,2025-11-14T12:27:29Z
621,8,Biztoc.com,barrons.com,"Warner Bros. Stock Rises. These Three Media Giants Are Circling, Report Says",,https://biztoc.com/x/6f94c528a70f3548,2025-11-14T12:26:58Z
622,8,Biztoc.com,barchart.com,Are Wall Street Analysts Predicting Air Products and Chemicals Stock Will Climb or Sink?,,https://biztoc.com/x/74e2515c8fd93c9d,2025-11-14T12:27:07Z
623,8,Biztoc.com,bloomberg.com,Emirates to Put Starlink on Aircraft in Major Win for SpaceX,,https://biztoc.com/x/13e505867305b0be,2025-11-14T12:27:25Z
624,8,Biztoc.com,investing.com,"Global investors pull back, cautious over tech valuations and US labour",,https://biztoc.com/x/8c4503fc3592a682,2025-11-14T12:27:12Z
625,8,Biztoc.com,bloomberg.com,Rachel Reeves Budget U-Turn Puts UK in a Tax Death Spiral,,https://biztoc.com/x/fec508bcf3615d10,2025-11-14T12:27:29Z
626,8,Verdict,GlobalData,Rumble to buy Northern Data in cloud expansion move,Northern Data maintains a GPU cluster in Europe and manages data centre facilities globally.,https://www.verdict.co.uk/rumble-northern-data-cloud/,2025-11-11T08:18:04Z
627,8,Coinspeaker,Zoran Spirkovski,Circle’s USDC Reaches $73.7B in Circulation as Q3 Profit Triples,Circle Internet Financial reported USDC USDC $1.00 24h volatility: 0.0% Market cap: $75.94 B Vol. 24h: $8.57 B circulation reached $73.7 billion at the end...,https://www.coinspeaker.com/circles-usdc-reaches-73-7b-in-circulation-as-q3-profit-triples/,2025-11-12T14:42:21Z
628,8,Line25.com,Kate Dagli,Букмекерская Контора 1вин Кз Ставки На Спорт И Казино Онлайн,"Официальный Портал Букмекерской Конторы 1вин Ваш Шанс сделать Ставки На Спорт В Казахстане Content знак Бонус За первый Депозит Какой Бонус При Регистрации дарит 1win Казино Отзывы Игроков Порядок ... Read More →
The post Букмекерская Контора 1вин Кз Ставки Н…",https://line25.com/articles/bukmekerskaia-kontora-1vin-kz-stavki-na-sport-i-kazino-onlain/,2025-11-17T19:29:15Z
629,8,Nikonrumors.com,[NR] admin,AkaraLabs released new “Slim Skin” cases for the Nikon Zf and Zfc cameras,AkaraLabs released a new “Slim Skin” case for the Nikon Zf and Zfc cameras. Akara Nikon Zf Slim Skin Cases: Akara Nikon Zfc Slim Skin Cases: Two versions are available: with and without a grip. The new case is 100% compatible with the AkaraLabs camera base pr…,https://nikonrumors.com/2025/11/18/akaralabs-released-new-slim-skin-cases-for-the-nikon-zf-and-zfc-cameras.aspx/,2025-11-18T20:04:47Z
630,8,CBC News,,Illicit crypto-to-cash deals are unlocking new ways to launder money in Canada,"Canada has long had a problem with dirty money in its economy, whether in banking or real estate, but the advent of anonymous crypto-to-cash services has opened new frontiers for potential laundering and illicit finance, experts say.",https://www.cbc.ca/news/business/crypto-to-cash-canada-9.6979928,2025-11-17T09:00:00Z
631,8,Cointelegraph,Cointelegraph by Brayden Lindrea,Tether mulls $1.15B deal with AI robotics startup Neura: Report,"$184 billion stablecoin issuer Tether is reportedly eyeing a $1.15 billion investment in Neura, a robotics startup that aims to produce 5 million robots for work and home tasks by 2030.",https://cointelegraph.com/news/tether-mulls-investment-robotics-startup-neura,2025-11-17T03:32:50Z
632,8,Cointelegraph,Cointelegraph by Bradley Peak,Why Tether is acting more like a central bank than a stablecoin,"With Treasury-heavy reserves, mint and redemption cycles and policy-like controls, Tether increasingly operates like a private dollar-linked central bank without a formal mandate or audit.",https://cointelegraph.com/news/why-tether-is-acting-more-like-a-central-bank-than-a-stablecoin,2025-11-10T15:28:08Z
633,8,Cointelegraph,Cointelegraph by Nate Kostar,"Stablecoin giant Tether backs Ledn, targets global crypto lending","Stablecoin giant Tether invests an undisclosed amount in Bitcoin-backed loan platform Ledn, as regulatory clarity and institutional interest revive the crypto-backed loans sector.",https://cointelegraph.com/news/tether-invests-bitcoin-lending-platform-ledn,2025-11-18T17:15:00Z
634,8,Cointelegraph,Cointelegraph by Sam Bourgi,"Tether to accelerate push into commodity lending with cash, USDt credit","Tether is scaling its commodity lending business after issuing $1.5 billion in credit, signaling broader ambitions beyond stablecoins and into global trade finance.",https://cointelegraph.com/news/tether-expands-commodity-lending-1-5b-trade-finance,2025-11-14T17:30:53Z
635,8,Cointelegraph,Cointelegraph by Turner Wright,Rumble to buy crypto miner Northern Data after Tether investment,"Reports said that the AI infrastructure purchase would be valued at about $767 million as part of a stock deal, about three months after a planned acquisition with Tether.",https://cointelegraph.com/news/rumble-to-buy-northern-data-after-tether-investment,2025-11-10T20:02:34Z
636,8,Yahoo Entertainment,Reuters,"Yield-bearing crypto assets poised to grow after regulatory clarity, report says","The U.S. has ‌enacted the GENIUS Act, a stablecoin law that creates a regulatory framework for dollar-pegged cryptocurrencies, sparking a surge in interest...",https://finance.yahoo.com/news/yield-bearing-crypto-assets-poised-143654327.html,2025-11-12T14:36:54Z
637,8,Yahoo Entertainment,Elizabeth Howcroft,Deutsche Boerse to add SocGen's stablecoins to its settlement business,PARIS (Reuters) -German stock exchange operator Deutsche Boerse plans to integrate stablecoins made by French ​bank Societe Generale in its settlement...,https://finance.yahoo.com/news/deutsche-boerse-add-socgens-stablecoins-074712018.html,2025-11-18T07:47:12Z
638,8,Coinspeaker,Tristan Greene,Tether Enters Strategic Partnership with Bitcoin-backed Loanmaker Ledn,Stablecoin issuer and fintech platform Tether has announced a strategic investment in Bitcoin BTC $89 100 24h volatility: 4.5% Market cap: $1.78 T Vol. 24h: ...,https://www.coinspeaker.com/tether-ledn-bitcoin-lending-partnership/,2025-11-18T17:02:26Z
639,8,Cointelegraph,Cointelegraph by Nate Kostar,"VCI Global unveils crypto treasury plan, backs Tether’s payments arm OOBIT","The Nasdaq-listed company will acquire $100 million in OOB tokens and oversee the digital treasury of OOBIT, a crypto payments company backed by Tether and Solana’s co-founder.",https://cointelegraph.com/news/vci-global-crypto-treasury-tether-payments-oobit,2025-11-11T18:28:57Z
640,8,Yahoo Entertainment,Anna Irrera and Archie Hunter,Tether Plans ‘Dramatic’ Expansion in Commodity-Trade Lending,"The El Salvador-based company plans to ramp up financing for trading in commodities including oil, cotton, wheat and other agricultural products, Ardoino...",https://finance.yahoo.com/news/tether-plans-dramatic-expansion-commodity-075648665.html,2025-11-14T07:56:48Z
641,8,Cryptonews,Amin Ayan,Tether Weighs $1.16B Investment in Germany’s Neura Robotics: FT,"Tether is considering a major investment in Germany’s Neura Robotics, exploring participation in a funding round worth as much as $1.16 billion, the...",https://cryptonews.com/news/tether-weighs-1-16b-investment-in-germanys-neura-robotics-ft/,2025-11-15T08:09:59Z
642,8,BeInCrypto,Mohammad Shahid,Tether Eyes $1 Billion Robotics Deal as It Expands Beyond USDT,"Tether is exploring a €1B investment in Neura Robotics as it expands beyond USDT into AI, robotics, and tokenized-market infrastructure.",https://beincrypto.com/tether-usdt-ai-robotics-investment/,2025-11-14T20:44:45Z
643,8,Yahoo Entertainment,Anusuya Lahiri,EXCLUSIVE: Draganfly Lands Second Order from Major US Telecom for 'Tethered' Emergency Drones,Draganfly Inc. (NASDAQ:DPRO) on Thursday announced a second purchase order from a Fortune 50 telecommunications company. DPRO stock is taking a breather. See...,https://finance.yahoo.com/news/exclusive-draganfly-lands-second-order-130014927.html,2025-11-13T13:00:14Z
