,coin_int_id,source,author,title,description,url,publishedAt
377,5,Cointelegraph,Cointelegraph by Sam Bourgi,Republic raises $100M for ETH purchases under unusual zero-interest deal,Republic Technologies obtained a $100 million zero-interest convertible loan to expand its Ethereum holdings and validator operations while limiting shareholder dilution.,https://cointelegraph.com/news/republic-technologies-100m-ethereum-financing,2025-11-17T16:02:56Z
378,5,Cointelegraph,Cointelegraph by Bradley Peak,Why Kohaku is central to Ethereum’s 2025 privacy shift,"Vitalik Buterin’s Kohaku upgrade turns years of Ethereum privacy research into practical wallet tools, adding opt-in shielding, safer recovery and responsible privacy.",https://cointelegraph.com/explained/why-kohaku-is-central-to-ethereum-s-2025-privacy-shift,2025-11-19T14:29:25Z
379,5,Cointelegraph,Cointelegraph by Ciaran Lyons,‘Very wide gap’ between XRP and Solana investor interest: Exec,"The President of Coinbase Asset Management told Cointelegraph that Bitcoin and Ethereum remain the favorites among investors, but beyond that, there is an air of uncertainty.",https://cointelegraph.com/news/crypto-market-investor-xrp-solana-bitcoin-ethereum-coinbase-exec,2025-11-16T05:02:11Z
380,5,Cointelegraph,Cointelegraph by Nate Kostar,Strategy’s Bitcoin dominance slips in October as corporate treasuries expand,"Michael Saylor’s Strategy still leads with 640,808 BTC, but new corporate treasuries in Bitcoin, Ethereum, and Solana are narrowing the gap, data shows.",https://cointelegraph.com/news/strategy-bitcoin-dominance-october-corporate-crypto-treasuries,2025-11-12T15:51:36Z
381,5,Cointelegraph,Cointelegraph by Biraajmaan Tamuly,"ETH falls into ‘buy zone,’ but volatility-adverse traders take a wait-and-see approach","Ethereum retests $3,000 as its Mayer Multiple falls below 1, entering a historical buy zone, while liquidity clusters signal short-term volatility ahead.",https://cointelegraph.com/news/eth-falls-into-buy-zone-but-volatility-adverse-traders-take-a-wait-and-see-approach,2025-11-18T17:29:42Z
382,5,Cryptonews,Sead Fadilpašić,"Why Is Crypto Down Today? – November 11, 2025","The crypto market is down today, with the cryptocurrency market capitalisation decreasing by 1%, now standing at $3.63 trillion. A large majority of the top ...",https://cryptonews.com/news/why-is-crypto-down-today-november-11-2025/,2025-11-11T11:44:21Z
383,5,CoinDesk,"Krisztian Sandor, AI Boost",Pantera-Backed Solana Company to Tokenize Its Shares With Superstate's Opening Bell,The move follows fellow Solana treasury firm Forward Industries making its stock available onchain.,https://www.coindesk.com/business/2025/11/12/pantera-backed-solana-company-to-tokenize-its-shares-with-superstate-s-opening-bell,2025-11-12T16:18:41Z
384,5,CoinDesk,Krisztian Sandor,DeFi Lender Aave to Roll Out Retail Crypto Yield App on Apple’s App Store,"With the Aave App, users will be able to earn over 5% annual yield on their deposits, higher than money market funds, the protocol said in a blog post.",https://www.coindesk.com/business/2025/11/17/defi-lender-aave-to-roll-out-retail-crypto-yield-app-on-apple-s-app-store,2025-11-17T14:39:38Z
385,5,CoinDesk,Helene Braun,"SoFi Launches Crypto Trading, Citing ‘Bank-Level Confidence’ as Key Edge","The federally regulated lender said 60% of users prefer trading crypto with a licensed institution over exchanges, citing compliance as a trust driver.",https://www.coindesk.com/business/2025/11/11/sofi-launches-crypto-trading-citing-bank-level-confidence-as-key-edge,2025-11-11T13:00:00Z
386,5,CoinDesk,Ian Allison,Revolut Enlists Polygon for Stablecoin Remittances in UK and EEA,"Revolut customers in the UK and non-European Union EEA countries can do crypto remittances in USDC, USDT, and POL.",https://www.coindesk.com/business/2025/11/18/revolut-enlists-polygon-for-stablecoin-remittances-in-uk-and-eea,2025-11-18T16:03:49Z
387,5,CoinDesk,Francisco Rodrigues,Stablecoin Spending Goes Mainstream With Opera MiniPay’s LatAm Integration,"The feature connects USDT balances to PIX and Mercado Pago, enabling users to pay with QR codes and converting to local currency instantly.",https://www.coindesk.com/business/2025/11/19/stablecoin-spending-goes-mainstream-with-opera-minipay-s-latam-integration,2025-11-19T23:43:55Z
388,5,CoinDesk,Oliver Knight,Lighter Raises $68M at $1.5B Valuation to Take on Decentralized Derivatives Rivals: Report,"Backed by Founders Fund, Haun Ventures and Robinhood, zk-rollup-powered Lighter plans to expand its institutional trading suite.",https://www.coindesk.com/business/2025/11/11/lighter-raises-usd68m-at-usd1-5b-valuation-to-take-on-decentralized-derivatives-rivals,2025-11-11T16:05:51Z
389,5,CoinDesk,"Krisztian Sandor, AI Boost","Tom Lee's BitMine Kept Buying Ether, Added 110K Tokens to Holdings",The crypto treasury firm now owns 2.9% of the ETH supply and holds nearly $398 million in cash for more purchases.,https://www.coindesk.com/business/2025/11/10/tom-lee-s-bitmine-kept-buying-ether-added-110k-tokens-to-holdings,2025-11-10T15:12:31Z
390,5,Cointelegraph,Cointelegraph by Biraajmaan Tamuly,Ethereum’s $200B tokenized asset base backs analysts’ calls for higher ETH price,"Ethereum’s $200 billion tokenized economy, falling exchange supply, and traditional finance footprint are fundamental factors that suggest ETH’s price is undervalued.",https://cointelegraph.com/news/ethereum-s-dollar200b-tokenized-asset-base-backs-analysts-calls-for-higher-eth-price,2025-11-11T17:47:11Z
391,5,Decrypt,Logan Hitchcock,"European Bank Revolut Taps Ethereum Network Polygon for Remittances, Stablecoin Payments",Revolut is teaming with Ethereum scaling network Polygon to power crypto remittances and stablecoin payments.,https://decrypt.co/349048/european-bank-revolut-ethereum-network-polygon-remittances-stablecoin-payments,2025-11-18T16:01:02Z
392,5,CoinDesk,Sam Reynolds,Asia Morning Briefing: Bitcoin ETFs Pull In $300M as Traders Rush to Buy the Dip,"After two weeks of heavy redemptions, U.S.-listed spot Bitcoin ETFs turned positive again, led by Fidelity and Ark, even as global fund flows remain uneven.",https://www.coindesk.com/markets/2025/11/12/asia-morning-briefing-bitcoin-etfs-see-usd300m-return-to-net-inflows-as-traders-buy-the-dip,2025-11-12T02:23:11Z
393,5,CoinDesk,Shaurya Malwa,"Retail Mood Sours Amid Crypto Selloff, Flashing Short-Term Bottom Signals for BTC, ETH, XRP","A fresh wave of pessimism is sweeping across crypto markets, but the mood shift may be doing more good than harm.",https://www.coindesk.com/markets/2025/11/13/retail-mood-sours-amid-crypto-selloff-flashing-short-term-bottom-signals-for-btc-eth-xrp,2025-11-13T19:06:18Z
394,5,CoinDesk,Margaux Nijkerk,The Protocol: Sweeping Uniswap Proposal ‘UNIfication’,"Also: Monad Tokenomics Unveiled, Anchorage Dabbles in BTC DeFi and Injective’s Native EVM.",https://www.coindesk.com/tech/2025/11/12/the-protocol-sweeping-uniswap-proposal-unification,2025-11-12T16:39:45Z
395,5,CoinDesk,Krisztian Sandor,Bitcoin Slides Below $95K in Worst Week Since March; Analyst Sets Downside Target at $84K,"BTC remains nearly 9% lower this week, its worts performance since March, while ETH, SOL declines more and XRP stands out.",https://www.coindesk.com/markets/2025/11/14/bitcoin-slides-below-usd95k-in-worst-week-since-march-analyst-sets-downside-target-at-usd84k,2025-11-14T20:35:12Z
396,5,BeInCrypto,Mohammad Shahid,EMCD’s Crypto Battle Highlights The Best Investment Strategies For Beginners,"EMCD’s Crypto Battle saw Michael Wrubel and Jan Warmus clash over risk, Bitcoin mining, and smart crypto strategies.",https://beincrypto.com/emcd-crypto-battle-october-2025-summary/,2025-11-13T21:54:17Z
397,5,Cryptonews,Anas Hassan,Bitcoin ETF Becomes Harvard’s Top Holding After 257% Stake Increase,"Harvard University has expanded its Bitcoin ETF holdings by 257% in the third quarter, making the iShares Bitcoin Trust its largest disclosed position with...",https://cryptonews.com/news/bitcoin-etf-becomes-harvards-top-holding-after-257-stake-increase/,2025-11-15T10:54:41Z
398,5,BeInCrypto,Lockridge Okoth,Tom Lee’s Ethereum Price Forecast Dismantled | US Crypto News,"What is the biggest crypto news today? Analysts challenge Tom Lee’s $60,000 Ethereum target, citing unrealistic RWA assumptions.",https://beincrypto.com/tom-lee-ethereum-price-prediction-slammed-us-crypto-news/,2025-11-10T14:52:44Z
399,5,BeInCrypto,Aaryamann Shrivastava,Ethereum Whales Snap Up $1.6 Billion ETH As Selling Declines,"Ethereum whales bought $1.6 billion in ETH as selling declines, signaling improving confidence while price tests key resistance.",https://beincrypto.com/ethereum-whales-accumulation-could-help-price/,2025-11-13T13:03:54Z
400,6,The Verge,"Jay Peters, Sean Hollister","We tried Valve’s new VR headset, PC, and controller — ask us anything!","Hi! I'm Jay Peters, a senior reporter here at The Verge. I'm perhaps the site's second-biggest Steam Deck fan, surpassed only by Sean Hollister, our unofficial handheld gaming PC reviewer. So you can imagine how excited we were to visit Valve's headquarters t…",https://www.theverge.com/games/818113/valve-steam-frame-machine-controller-vr-headset-pc-ask-us-anything-ama,2025-11-12T17:21:31Z
401,6,Yanko Design,Ida Torres,Kengo Kuma’s Wave-Inspired Tower Rises in Busan,"Kengo Kuma’s Wave-Inspired Tower Rises in BusanThere’s something mesmerizing about watching waves crash against a harbor, the way they ripple and fold into themselves with an effortless rhythm. Japanese architect Kengo...",https://www.yankodesign.com/2025/11/11/kengo-kumas-wave-inspired-tower-rises-in-busan/,2025-11-11T22:30:18Z
402,6,BeInCrypto,Brian McGleenon,3 Countries That Could Send XRP Soaring in 2026,"XRP adoption may surge in 2026 as global crypto regulations and live remittance corridors align across Japan, UAE, and Europe.",https://beincrypto.com/3-countries-that-could-send-xrp-soaring-in-2026/,2025-11-13T13:00:00Z
403,6,PEOPLE,Valerie Mesa,How to Watch the Dazzling Display of Northern Lights in These 8 States Tonight,"If you missed the last round of auroras, you're in luck as space weather forecasters say another show may be on the way",https://people.com/how-to-watch-the-northern-lights-tonight-november-10-2025-11846627,2025-11-10T16:40:00Z
404,6,BBC News,Laura Devlin - in Norwich,Bid to protect 'masterpiece' concrete shell roofs,"The ""delicate concrete forms"" are the only UK design by a Swiss engineer, a campaign group says.",https://www.bbc.com/news/articles/cn97qxxl830o?xtor=AL-72-%5Bpartner%5D-%5Byahoo.north.america%5D-%5Bheadline%5D-%5Bnews%5D-%5Bbizdev%5D-%5Bisapi%5D,2025-11-10T06:22:35Z
405,6,Yahoo Entertainment,Chris Adam,"Here’s the Real Cost of Failing To Save for Retirement, According to Gen X",Gen X reveals the hidden cost of not saving for retirement and why it could derail your financial future. Learn what’s at stake and how to avoid it.,https://finance.yahoo.com/news/real-cost-failing-save-retirement-225507705.html,2025-11-18T22:55:07Z
406,6,Yahoo Entertainment,Cassidy Lovell,Officials make disturbing discovery while inspecting truck at border crossing: 'Irregularities',It's one of the world's largest illicit trades.,https://www.yahoo.com/news/articles/officials-disturbing-discovery-while-inspecting-230000752.html,2025-11-17T23:00:00Z
407,6,Yahoo Entertainment,Mariah Botkin,Experts issue warning after observing concerning shift in the Arctic: 'A lot of what we have today will be lost',"""These organisms cannot survive.""",https://www.yahoo.com/news/articles/experts-issue-warning-observing-concerning-031500517.html,2025-11-09T03:15:00Z
408,6,Yahoo Entertainment,Daysia Tolentino,Authorities make shocking discoveries during massive bust: 'Could have caused high morbidity',The issue of smuggling is immense.,https://www.yahoo.com/news/articles/authorities-shocking-discoveries-during-massive-230000364.html,2025-11-15T23:00:00Z
409,6,Coinspeaker,Parth Dubey,Five XRP ETFs Listed on DTCC: Is XRP Touching $10 Soon?,"This week, five spot XRP XRP $2.45 24h volatility: 2.5% Market cap: $147.52 B Vol. 24h: $4.67 B exchange-traded funds from Franklin Templeton, Bitwise...",https://www.coinspeaker.com/five-xrp-etfs-listed-dtcc-is-xrp-touching-10-soon/,2025-11-10T07:46:42Z
410,6,Kotaku,Kotaku Deals,"Gaming Chair Is Selling for Pennies, Amazon Drops 4.5-Rated Comfort Model to Record Low","Game or work in comfort with lumbar support, footrest, and 300-pound capacity.
The post Gaming Chair Is Selling for Pennies, Amazon Drops 4.5-Rated Comfort Model to Record Low appeared first on Kotaku.",https://kotaku.com/gaming-chair-is-selling-for-pennies-amazon-drops-4-5-rated-comfort-model-to-record-low-2000643991,2025-11-13T14:35:49Z
411,6,Chron.com,Ahmed Humble,Houston Methodist takes on Big Insurance in high-stakes pricing fight,"At the center of the dispute is how insurers price ""out-of-network"" care.",https://www.chron.com/news/article/houston-methodist-lawsuit-insurance-21171404.php,2025-11-13T20:57:12Z
412,6,Yahoo Entertainment,Sydney Lake,"MacKenzie Scott says her college roommate loaned her $1,000 so she wouldn’t have to drop out—and is now inspiring her to give away billions",MacKenzie Scott has donated over $19 billion in the past five years.,https://www.yahoo.com/news/articles/mackenzie-scott-says-her-college-090200510.html,2025-11-16T09:02:00Z
413,6,SlashGear,Bob Sharp,US Navy Techs Forced To Salvage Parts From Their Own Subs & Fighter Jets,"The U.S. Navy operates some of the most advanced and lethal submarines and fighter jets in the world, including the Virginia-class subs and F-35 Lightning II...",https://www.slashgear.com/2017905/us-navy-submarine-jet-parts-shortage-salvage/,2025-11-10T15:45:00Z
414,6,NPR,Juliana Kim,Trump's National Guard deployments face mounting legal pushback,"President Trump's efforts to send National Guard troops to U.S. cities have been repeatedly met with resistance in the courts — most recently, in Tennessee.",https://www.npr.org/2025/11/19/nx-s1-5612793/national-guard-tennessee-trump-court-lawsuit,2025-11-19T10:00:00Z
415,6,Business Insider,Bradley Saacks,A new hedge fund launching next year hopes to be the 'farm team' for the $5 trillion industry,Riptide Advisors will let unproven young analyst talent run small portfolios and gradually gain capital and responsibilities.,https://www.businessinsider.com/riptide-advisors-train-next-generation-hedge-fund-talent-2025-11,2025-11-15T12:47:01Z
416,6,9to5Mac,Ryan Christoffel,Apple TV reveals major sci-fi series is coming back soon,"Monarch: Legacy of Monsters is Apple TV’s big-budget sci-fi epic starring Kurt Russell and more importantly, Godzilla. Now, Apple has announced that Monarch season 2 is coming soon and shared the first teaser trailer.



 more…",https://9to5mac.com/2025/11/13/apple-tv-reveals-major-sci-fi-series-is-coming-back-soon/,2025-11-13T14:33:14Z
417,6,Business Insider,"Rachel Askinasi,Anneta Konstantinides",Ina Garten is the queen of easy Thanksgiving. Here are 9 recipes we think should be on your menu this year.,"We love Ina Garten's recipes, especially during the holidays. Her best Thanksgiving dishes include easy turkey, mac and cheese, and potato gratin.",https://www.businessinsider.com/ina-garten-best-thanksgiving-recipes,2025-11-10T14:18:01Z
418,6,CNN,"Esha Mitra, Rhea Mogul, Sana Noor Haq and Ayushi Shah, CNN",India on edge after deadly car explosion in capital region. Here’s what we know,"India’s capital is on edge after a car explosion ripped through a popular Delhi neighborhood on Monday, killing at least 10 people and injuring many others.",https://www.cnn.com/2025/11/10/world/new-delhi-explosion-red-fort-intl,2025-11-11T10:25:00Z
419,6,USA Today,"Doyle Rice, USA TODAY","La Niña will dominate winter weather, federal forecasters say","La Niña effects vary drastically by region, even within the United States. Here's what it means for winter weather.",https://www.usatoday.com/story/news/weather/2025/11/13/la-nina-winter-weather-update/87247842007/,2025-11-13T16:30:34Z
420,6,Yahoo Entertainment,BRUCE SCHREINER and DYLAN LOVAN,Scrapyard workers recount horrific scene after UPS plane crash destroyed their Kentucky business,"Supervisor Adam Bowman was loading metal onto a truck at a scrapyard just south of the Louisville, Kentucky, airport when he heard what he first thought was ...",https://www.yahoo.com/news/articles/scrapyard-workers-recount-horrific-scene-212642445.html,2025-11-14T21:26:42Z
421,6,Yahoo Entertainment,DEEPTI HAJELA,Naturalized US citizens thought they were safe. Trump's immigration policies are shaking that belief,"When he first came to the United States after escaping civil war in Sierra Leone and spending almost a decade in a refugee camp, Dauda Sesay had no idea he...",https://www.yahoo.com/news/articles/naturalized-us-citizens-thought-were-050121313.html,2025-11-15T05:01:21Z
422,6,Yahoo Entertainment,Robert Rapier,A New Oil Price War Is Now Underway,"OPEC+’s surprise output increase signals a strategic shift from price defense to market-share dominance, reigniting the power struggle with U.S. shale and...",https://finance.yahoo.com/news/oil-price-war-now-underway-190000621.html,2025-11-10T19:00:00Z
423,6,Yahoo Entertainment,David Okoya,"Ripple Has 'No Plans' For Public Offering, President Says Despite Crypto Listing Boom","Blockchain payments and infrastructure company Ripple has “no plans” of going public, Ripple President Monica Long says. “We do not have an IPO timeline...",https://finance.yahoo.com/news/ripple-no-plans-public-offering-152642285.html,2025-11-11T15:26:42Z
424,6,Biztoc.com,benzinga.com,Brad Garlinghouse Looks Beyond Crypto As Ripple Targets Traditional Finance With XRP-Powered Blockchain Services,"XRP (CRYPTO: XRP) issuer Ripple is expanding its vision beyond crypto, aiming to bridge traditional finance and blockchain through institutional-grade solutions.
What Happened: In an interview with CNBC at the Ripple Swell 2025 conference on Monday, CEO Brad …",https://biztoc.com/x/16e4f88dff919ff0,2025-11-11T13:58:28Z
425,6,9to5Mac,Marcus Mendes,I can’t work on my Mac without this little keypad anymore,"Offloading keyboard shortcuts to a programmable macro keypad is the best productivity hack I’ve ever done.



 more…",https://9to5mac.com/2025/11/18/macro-keypad-productivity-on-macos/,2025-11-19T00:41:12Z
426,6,Cupofjo.com,Joanna Goddard,Gift Guide #5: Your Boyfriend (or Husband) Who Makes Pancakes for Your Kids and Never Met a Bookstore He Didn’t Love.,"A red beanie (everyone looks cute in one), $58, or gloves from an alpaca farm in Montana, $23, to keep him warm all winter.

A “rip-roaring” “gorgeously reported” book about New York from 1986-1990, $30, or one of the best novels you read this year, so you ca…",https://cupofjo.com/2025/11/19/best-gifts-husbands-men/,2025-11-19T23:20:28Z
427,6,Biztoc.com,finance.yahoo.com,XRP Boss Says Fed Plans Could Be ‘Game Changer’ for Ripple,"A top executive at Ripple — the company that issues XRP — has said a recent proposal by a senior Federal Reserve official could be a game-changer.
Stu Alderoty was reacting to a speech given by Governor Christopher Waller, who has suggested that crypto firms …",https://biztoc.com/x/8eb368f0a0f7aee9,2025-11-10T13:26:44Z
428,6,Cryptonews,Connor Sephton,XRP Boss Says Fed Plans Could Be ‘Game Changer’ for Ripple,A top executive at Ripple — the company that issues XRP — has said a recent proposal by a senior Federal Reserve official could be a game-changer.Stu...,https://cryptonews.com/exclusives/xrp-boss-says-fed-plans-could-be-game-changer-for-ripple/,2025-11-10T12:55:09Z
429,6,Dlnews.com,Eric Johansson,Why is XRP’s price down despite the ETF debut?,Canary's XRP ETF debuted on Thursday. It saw $250 million of inflows in its first day of trading. So why is the Ripple-linked cryptocurrency's price down?,https://www.dlnews.com/articles/markets/why-is-xrp-price-down-despite-the-ripple-etf-debut/,2025-11-14T18:00:00Z
430,6,TheStreet,Aparajita Chatterjee,"Daily Market Wrap: Paramount Skydance, CoreWeave, and SoftBank","The market had a mixed performance on Tuesday, Nov. 11, with tech stocks underperforming as a ripple effect of Nvidia’s lackluster performance. The S&P 500...",https://www.thestreet.com/economy/daily-market-wrap-paramount-skydance-coreweave-and-softbank,2025-11-12T01:42:16Z
431,6,Android Police,Ben Khalesi,How One UI 8 made my phone feel less like work,Why One UI 8 feels like a breath of fresh air,https://www.androidpolice.com/one-ui-8-made-phone-fun/,2025-11-10T13:00:10Z
432,6,Yahoo Entertainment,E. Napoletano,Buying a home doesn't have to delay your next life milestone. Here's how to achieve your goals.,"Many people put off life milestones, such as having kids, because they’re saving for a home. Discover how to buy a house and achieve other goals...",https://finance.yahoo.com/personal-finance/mortgages/article/how-to-afford-homeownersip-and-other-life-milestones-193339952.html,2025-11-19T19:33:39Z
433,6,Nature.com,"Brittany Janis, Cathy Richards",Who will fill the climate-data void left by the Trump administration?,US withdrawal from monitoring projects has sent the world scrambling for alternatives.,https://www.nature.com/articles/d41586-025-03532-4,2025-11-14T00:00:00Z
434,6,CoinDesk,Shaurya Malwa,XRP ETF Fails to Bump Bulls as Ripple-Linked Token Plunges 7.3% Amid BTC Selloff,"Brutal selloff breaks psychological $2.30 floor, erasing recent gains as distribution overwhelms historic XRPC debut.",https://www.coindesk.com/markets/2025/11/14/xrp-etf-fails-to-bump-bulls-as-ripple-linked-token-plunges-7-3-amid-btc-selloff,2025-11-14T05:06:01Z
435,6,CoinDesk,"Shaurya Malwa, CD Analytics",XRP ETF Hopes Drive Ripple-Linked Token Bulls to Target $2.65,"The breakout attempt at $2.57 met resistance as profit-taking emerged, though buyers held firm above the $2.52-$2.53 zone to confirm short-term support.",https://www.coindesk.com/markets/2025/11/11/xrp-etf-hopes-drive-ripple-linked-token-bulls-to-target-usd2-65,2025-11-11T04:38:56Z
436,6,CoinDesk,"Shaurya Malwa, CD Analytics",XRP Moves 3% as Ripple-Linked Token's ETF to Go Live at U.S. Market Open,Token rallies through key resistance with 31% volume surge as Nasdaq certifies first U.S. spot XRP ETF,https://www.coindesk.com/markets/2025/11/13/xrp-moves-3-as-ripple-linked-token-s-etf-to-go-live-at-u-s-market-open,2025-11-13T05:26:41Z
437,6,CoinDesk,CoinDesk Indices,CoinDesk 20 Performance Update: Ripple (XRP) Gains 5.1% As Nearly All Assets Rise,"Uniswap (UNI) was also among the top performers, up 4.1% from Wednesday.",https://www.coindesk.com/coindesk-indices/2025/11/13/coindesk-20-performance-update-ripple-xrp-gains-5-1-as-nearly-all-assets-rise,2025-11-13T14:29:00Z
438,6,Thoughtcatalog.com,Karin Hadadan,A Short Prayer To Ask God To Reignite The Light He Placed Inside You,"God has placed a light within each of us, and even when it feels dim, we are still illuminating His glorious light. Here is a short prayer to recite when you feel you’ve lost your spark. Dear…",https://thoughtcatalog.com/karin-hadadan/2025/11/a-short-prayer-to-ask-god-to-reignite-the-light-he-placed-inside-you/,2025-11-19T23:10:00Z
439,6,PetaPixel,Ken Klein,Award-Winning Photographers Describe Emotional Toll of Documenting ICE Arrests,"Award-winning photographers documenting immigration arrests in New York City have witnessed far-flung strife and conflict, but nothing quite like this.
[Read More]",https://petapixel.com/2025/11/10/award-winning-photographers-describe-emotional-toll-of-documenting-ice-arrests/,2025-11-10T20:07:47Z
440,6,The Indian Express,Ganesha Speaks,"Capricorn Horoscope Today, 15 November 2025: Business decisions today are clear-eyed and effective","Capricorn Horoscope Today, 15 November 2025: Let intuition guide you. Whether through connection or reflection, today becomes meaningful in unexpected and lasting ways.",https://indianexpress.com/article/horoscope/capricorn-horoscope-today-15-november-2025-daily-astrology-prediction-for-capricorn-career-finance-money-love-10364601/,2025-11-15T00:30:58Z
441,6,Skift,Darin Graham,Singapore Becomes First Country to Tax Air Travelers for Green Jet Fuel,Singapore’s new passenger levy sends a message to the aviation world: Sustainable fuels are no longer optional. But can a tax alone jumpstart a struggling green fuel market?,http://skift.com/2025/11/13/singapore-becomes-first-country-to-tax-air-travelers-for-green-jet-fuel/,2025-11-13T16:10:25Z
442,6,Playstation.com,Daniel Noel,Black Ops 7 — what to expect with the replayable co-op Campaign Endgame experience,"The year is 2035 and the world is on the brink of chaos. When Call of Duty: Black Ops 7 launches on PS5 and PS4 on November 14, players will face new and returning threats in the co-op Campaign, culminating in the replayable Endgame experience. With game laun…",https://blog.playstation.com/2025/11/10/black-ops-7-what-to-expect-with-the-replayable-co-op-campaign-endgame-experience/,2025-11-10T18:15:13Z
443,6,Bolde.com,Danielle Sachs,14 Doomsday Predictions That Were Dismissed—Until They Started Coming True,These doomsday predictions were dismissed until they started coming true...,https://www.bolde.com/15-doomsday-predictions-that-were-dismissed-until-they-started-coming-true/,2025-11-14T10:15:14Z
444,6,The Indian Express,PTI,Punjab: Batch of 72 teachers heads to Finland for training,"Bains said this batch will take the total to 216 teachers who have imbibed Finland's pedagogy excellence, showcasing the state government's commitment to education transformation.",https://indianexpress.com/article/education/punjab-batch-of-72-teachers-heads-to-finland-for-training-10368737/,2025-11-16T06:44:50Z
