,coin_int_id,source,author,title,description,url,publishedAt
192,3,Ambcrypto.com,Ishika Kumari,eToro CFO hails ‘diversified strength’ as digital assets lift earnings 43%,"With crypto trades surging 84%, is eToro quietly becoming the next big name in digital finance?",https://ambcrypto.com/etoro-cfo-hails-diversified-strength-as-digital-assets-lift-earnings-43/,2025-11-11T19:00:31Z
193,3,CryptoSlate,Gino Matos,Here’s why Bitcoin recovered after plunge to $100k and $610M market wipe,"Bitcoin fell to $100,800 on November 12, down 4.2% in 24 hours, as the broader crypto market shed roughly $65 billion, before recovering early in the morning to $103,000. The crash resulted in over $610 million in liquidations of leveraged positions, accordin…",https://cryptoslate.com/bitcoin-plunges-to-100k-then-recovers-as-dollar-firms-610m-wiped-from-market/,2025-11-13T10:36:54Z
194,3,Coinjournal.net,Collaborations,Analysts back Dogecoin (DOGE) and Remittix (RTX) to end November with a bang,Remittix is gaining its own wave of interest by doing something simple: existing. The project has already raised over $28.1 million from the sale of 684 million tokens at $0.1166. BitMart and LBank have already confirmed listings and the team has been teasing…,https://coinjournal.net/news/analysts-back-dogecoin-doge-and-remittix-rtx-to-end-november-with-a-bang/,2025-11-15T13:37:19Z
195,3,The Times of India,Piyush Shukla,"Bitcoin price is recovering fast at $104,873.50, up 1.73%: Why is BTC surging today? Can BTC sustain momentum as ETF inflows return? Bitcoin hits recovery barrier as volatility rises","Bitcoin price today: Bitcoin is bouncing back fast. It’s trading near $104,873.50, up 1.73% today. Big money is flowing in again. US spot Bitcoin ETFs saw a huge $523.98 million inflow. That’s a clear sign institutions are back. The market is also cheering si…",https://economictimes.indiatimes.com/news/international/us/bitcoin-price-is-recovering-fast-at-104873-50-up-1-73-why-is-btc-surging-today-can-btc-sustain-momentum-as-etf-inflows-return-bitcoin-hits-recovery-barrier-as-volatility-rises/articleshow/125275571.cms,2025-11-12T13:48:48Z
196,3,newsBTC,Christian Encila,"Bitcoin To Eclipse Gold, Eric Trump Says—Calling BTC The ‘Greatest Asset’ Ever","According to remarks made at Yahoo Finance’s Invest event, Eric Trump told attendees he expects a major shift in how money flows between traditional stores of value and newer digital assets. Related Reading: Kiyosaki Stands His Ground—No Selling, More Bitcoin…",http://www.newsbtc.com/news/bitcoin/bitcoin-to-eclipse-gold-eric-trump-says-calling-btc-the-greatest-asset-ever/,2025-11-16T13:00:58Z
197,3,newsBTC,Sebastian Villafuerte,Ethereum Trading Volume On Binance Surpasses $6 Trillion: A Speculative Frenzy Unfolds,"Ethereum has reclaimed key price levels after a volatile weekend, emerging as one of the strongest performers in the ongoing market rebound. As Bitcoin stabilizes near $100K, altcoins are gaining momentum, with ETH once again leading the charge. The recovery …",http://www.newsbtc.com/news/ethereum/ethereum-trading-volume-on-binance-surpasses-6-trillion-a-speculative-frenzy-unfolds/,2025-11-10T21:00:54Z
198,3,PR Newswire UK,,Blockchain for Good Alliance (BGA) Recognized Groundbreaking Blockchain Projects Advancing the SDGs at 2025 Forum,"COPENHAGEN, Denmark, Nov. 17, 2025 /PRNewswire/ -- The Blockchain for Good Alliance (BGA), a flagship non-profit founded by Bybit and championing responsible innovation, successfully concluded the Blockchain Impact Forum 2025 in Copenhagen alongside the Unite…",https://www.prnewswire.co.uk/news-releases/blockchain-for-good-alliance-bga-recognized-groundbreaking-blockchain-projects-advancing-the-sdgs-at-2025-forum-302617009.html,2025-11-17T11:04:00Z
199,3,PR Newswire UK,,"Foreign Exchange Market worth USD 1.1 Trillion by 2030, Growing at 5.8% CAGR as Digital Trading and Liquidity Strengthen; Asia Pacific Emerges as Key Region, Reports Mordor Intelligence","HYDERABAD, India, Nov. 19, 2025 /PRNewswire/ -- According to Mordor Intelligence, the foreign exchange market size stood at USD 0.89 trillion in 2025 and is expected to reach USD 1.18 trillion by 2030, advancing at a 5.83% CAGR. Growth is driven by expanding …",https://www.prnewswire.co.uk/news-releases/foreign-exchange-market-worth-usd-1-1-trillion-by-2030--growing-at-5-8-cagr-as-digital-trading-and-liquidity-strengthen-asia-pacific-emerges-as-key-region-reports-mordor-intelligence-302619921.html,2025-11-19T11:02:00Z
200,4,Cryptonews,Hassan Shittu,Dogecoin Treasury Bet Backfires: CleanCore Stock Crashes 78% to Record Low,"CleanCore Solutions’ aggressive push into Dogecoin as an official treasury asset has triggered a market backlash, with the company’s stock collapsing nearly ...",https://cryptonews.com/news/dogecoin-treasury-bet-backfires-cleancore-stock-crashes-78-to-record-low/,2025-11-14T15:53:11Z
201,4,BeInCrypto,Oihyun Kim,Bitcoin Touches $93K Low as Market Sentiment Hits Extreme Fear,"Bitcoin rebounds after $93K low, as $510M liquidations and extreme fear grip the market.",https://beincrypto.com/bitcoin-rebounds-extreme-fear-liquidations/,2025-11-16T23:42:37Z
202,4,BeInCrypto,Lockridge Okoth,Tom Lee’s BitMine Acts Fast as Ethereum Whale Pattern Breaks | US Crypto News,"What is the biggest crypto news today? Tom Lee’s BitMine just bought 9,176 ETH as whales split between panic-selling and accumulation .",https://beincrypto.com/ethereum-whale-tom-lee-bitmine-us-crypto-news/,2025-11-14T17:59:18Z
203,4,Coingape,Varinder Singh,"Crypto Market Crash: Here’s Why Bitcoin, ETH, SOL, ZEC, & Other Altcoins Are Falling","The crypto market crash continues in November, with the global market cap dropping from $4.28 trillion to a 6-month low of $3.27 trillion in a month. Bitcoin...",https://coingape.com/crypto-market-crash-heres-why-bitcoin-eth-sol-zec-other-altcoins-are-falling/,2025-11-14T07:26:35Z
204,4,Biztoc.com,benzinga.com,Elon Musk Says 'It's Time' To Put Dogecoin On The Moon But It Is Not DOGE That Surges,"Tesla (NASDAQ:TSLA) CEO Elon Musk has sent the price of a Solana memecoin surging with an X post rekindling a 2021 Dogecoin promise.
“It’s time,” Musk said on Nov. 3 on X, referring to a 2021 promise “to put a literal Dogecoin on the literal moon” with a Spac…",https://biztoc.com/x/8291ef2c14007b23,2025-11-12T14:30:03Z
205,4,Biztoc.com,benzinga.com,"Bitcoin, Ethereum, XRP, Dogecoin Extend Losses Ahead Of Shutdown End","Bitcoin has slipped to $103,000 amid mixed macro signals and ongoing uncertainty surrounding the U.S. government shutdown.
Cryptocurrency
Ticker
Price
Bitcoin
(CRYPTO: BTC)
$103,196.76
Ethereum
(CRYPTO: ETH)
$3,467.52
Solana
(CRYPTO: SOL)
$159.15
XRP
(CRYPTO:…",https://biztoc.com/x/297aa1589efe7983,2025-11-11T19:44:26Z
206,4,CoinDesk,"Shaurya Malwa, CD Analytics","Memecoin Majors Diverge as DOGE Reclaims Trendline, SHIB Tests Daily Downtrend Floor",Dogecoin rebounding sharply from a heavy-volume flush while Shiba Inu broke key support before staging an aggressive intraday reversal.,https://www.coindesk.com/markets/2025/11/16/doge-reclaims-trendline-shib-tests-daily-downtrend-floor,2025-11-16T08:29:10Z
207,4,CoinDesk,"Shaurya Malwa, CD Analytics",Dogecoin Tests Weekly EMA Support as Bears Drive 5% Slide,"The sharp move unfolded within a $0.0121 range as price action confirmed a textbook lower-high, lower-low formation.",https://www.coindesk.com/markets/2025/11/13/dogecoin-tests-weekly-ema-support-as-bears-drive-5-slide,2025-11-13T05:17:51Z
208,4,Yahoo Entertainment,Aniket Verma,"Dogecoin Looks Back To The Time When Only Moms Accepted It, Charts Progress To Now With DOGE Emerging As Institutional Asset",Dogecoin (CRYPTO: DOGE) highlighted on Thursday its evolution from a “joke” to a serious cryptocurrency now featured in U.S. index cryptocurrency funds. This...,https://finance.yahoo.com/news/dogecoin-looks-back-time-only-194539204.html,2025-11-14T19:45:39Z
209,4,Yahoo Entertainment,David Okoya,Elon Musk Says 'It's Time' To Put Dogecoin On The Moon But It Is Not DOGE That Surges,"Tesla (NASDAQ:TSLA) CEO Elon Musk has sent the price of a Solana memecoin surging with an X post rekindling a 2021 Dogecoin promise. “It’s time,” Musk said...",https://finance.yahoo.com/news/elon-musk-says-time-put-141608773.html,2025-11-12T14:16:08Z
210,4,Biztoc.com,benzinga.com,"Bitcoin Crashes To $98,000 As Ethereum, Dogecoin Plunge On 'Sell-The-News' Panic","Bitcoin broke decisively below the $100,000 psychological level on Thursday, despite optimism surrounding the end of the U.S. government shutdown.
The drop came as spot Bitcoin ETFs have been recording heavy net outflows, removing the institutional buying pre…",https://biztoc.com/x/d04444324f830c84,2025-11-13T21:34:01Z
211,4,Line25.com,Kate Dagli,Sg On Line Casino Ανασκόπηση Καζίνο Και Αποκλειστικό Μπόνους,"Μπόνους Έως 500 + Two Hundred Fs Για Νέους Παίκτες Content Παιχνίδια Καζίνο ✋ Προωθητικές Ενέργειες Του Sg Casino  Κατάλογος Παιχνιδιών Του Sg Casino Sg Καζίνο Μπόνους Τρόποι ... Read More →
The post Sg On Line Casino Ανασκόπηση Καζίνο Και Αποκλειστικό Μπόν…",https://line25.com/articles/sg-on-line-casino-anaskopese-kazino-kai-apokleistiko-mponous/,2025-11-19T16:31:27Z
212,4,CoinDesk,Shaurya Malwa,Dogecoin Near Make-or-Break Zone as Fresh Bitcoin Slide Pulls Down Majors by 5%,"Leader in cryptocurrency, Bitcoin, Ethereum, XRP, blockchain, DeFi, digital finance and Web 3.0 news with analysis, video and live price updates.",https://www.coindesk.com/markets/2025/11/12/dogecoin-near-make-or-break-zone-as-fresh-bitcoin-slide-pulls-down-majors-by-5,2025-11-12T05:30:44Z
213,4,CoinDesk,"Shaurya Malwa, CD Analytics",Dogecoin Eyes Rebound After Multi-Year Trendline Break Tests $0.15 Floor,"The memecoin's technical structure is weakened, with key support at $0.1520 needing to hold to prevent further declines.",https://www.coindesk.com/markets/2025/11/18/dogecoin-eyes-rebound-after-multi-year-trendline-break-tests-usd0-15-floor,2025-11-18T07:05:33Z
214,4,CoinDesk,"Shaurya Malwa, CD Analytics","Dogecoin Surges 6% as Trump Promised $2K Stimulus Brings Back 2021-Era DOGE, SHIB Rally Vibes","Former President Trump's comments on tariffs spurred interest in speculative assets, boosting meme coin sentiment.",https://www.coindesk.com/markets/2025/11/10/dogecoin-surges-6-as-trump-promised-usd2k-stimulus-brings-back-2021-era-doge-shib-rally-vibes,2025-11-10T05:24:01Z
215,4,CoinDesk,"Shaurya Malwa, CD Analytics",What Next For Dogecoin as Bitcoin 'Death Cross' Puts Major Memecoin in Crosshairs,"Bitcoin's Death Cross, a bearish signal, occurred as the 50-day moving average fell below the 200-day moving average.",https://www.coindesk.com/markets/2025/11/18/what-next-for-dogecoin-as-bitcoin-death-cross-puts-major-memecoin-in-crosshairs,2025-11-17T18:54:08Z
216,4,Line25.com,Kate Dagli,Букмекерская Контора 1вин Кз Ставки На Спорт И Казино Онлайн,"Официальный Портал Букмекерской Конторы 1вин Ваш Шанс сделать Ставки На Спорт В Казахстане Content знак Бонус За первый Депозит Какой Бонус При Регистрации дарит 1win Казино Отзывы Игроков Порядок ... Read More →
The post Букмекерская Контора 1вин Кз Ставки Н…",https://line25.com/articles/bukmekerskaia-kontora-1vin-kz-stavki-na-sport-i-kazino-onlain/,2025-11-17T19:29:15Z
217,4,Forbes,"Siladitya Ray, Forbes Staff, 
 Siladitya Ray, Forbes Staff
 https://www.forbes.com/sites/siladityaray/","Bitcoin Drops Below $90,000 For The First Time Since April As Crypto Slide Continues",The world’s most valuable cryptocurrency’s weeks-long sell-off has now erased all its gains since the start of 2025.,https://www.forbes.com/sites/siladityaray/2025/11/18/bitcoin-drops-below-90000-for-the-first-time-since-april-as-crypto-slide-continues/,2025-11-18T05:17:29Z
218,4,Yahoo Entertainment,Sidhartha Shukla,Crypto’s Riskiest Tokens Plummet to Pandemic-Era Levels,"The MarketVector Digital Assets 100 Small-Cap Index, which tracks the 50 smallest digital assets in a basket of 100, fell to its lowest level since November ...",https://finance.yahoo.com/news/crypto-riskiest-tokens-plummet-pandemic-111846545.html,2025-11-17T14:28:11Z
219,4,Yahoo Entertainment,,Better Crypto Buy: XRP vs. Dogecoin,,https://consent.yahoo.com/v2/collectConsent?sessionId=1_cc-session_3f8189be-1526-4086-887c-45ce83278355,2025-11-18T13:00:00Z
220,4,Cointelegraph,Cointelegraph by Jesse Coghlan,"VanEck Solana ETF goes live, Grayscale DOGE ETF expected on Monday","The flood of crypto ETFs has begun, with VanEck’s Solana ETF launching on Monday, and many more ETFs expected to go live over the next week.",https://cointelegraph.com/news/vaneck-solana-etf-live-grayscale-doge-etf-expected-monday,2025-11-18T02:06:37Z
221,4,BeInCrypto,Lockridge Okoth,Grayscale and Bitwise Dogecoin ETFs Could Launch Within Days as SEC Review Clock Ticks,Grayscale and Bitwise Dogecoin ETFs may launch by late November as a 20-day SEC review window speeds approval.,https://beincrypto.com/grayscale-bitwise-dogecoin-etf-sec-review/,2025-11-17T18:55:51Z
222,4,Cryptonews,Sujha Sundararajan,Canary Capital to Launch First Memecoin ETF to Track Price of MOG Coin,"Crypto fund manager Canary Capital has filed to launch the first U.S. exchange-traded fund (ETF) tied directly to MOG Coin, a memecoin on the Ethereum...",https://cryptonews.com/news/canary-capital-to-launch-first-memecoin-etf-to-track-price-of-mog-coin/,2025-11-13T01:47:47Z
223,4,newsBTC,Scott Matherson,How Did The Dogecoin Price React To Elon Musk’s Latest Dog Post?,"The world’s richest man, Elon Musk, recently posted a picture of a Shiba Inu, Dogecoin’s mascot. However, the Dogecoin price failed to react positively to the post, as it has most times done in the past when Musk made similar posts.  Dogecoin Price Fails To R…",http://www.newsbtc.com/news/dogecoin/dogecoin-react-to-elon-musks/,2025-11-15T17:00:20Z
224,4,newsBTC,Scott Matherson,"Dogecoin Cup And Handle Pattern Is Returning, What Happens To Price If It’s Completed?","A Dogecoin cup and handle pattern has returned to the chart, which could be pointing to another recovery trend. The chart pattern was highlighted by crypto analyst Melikatrader on a TradingView post, showing that there could be a reversal coming for Dogecoin …",http://www.newsbtc.com/news/dogecoin/dogecoin-cup-and-handle/,2025-11-18T07:30:12Z
225,4,newsBTC,Scott Matherson,Analyst Predicts Dogecoin Price “Historic Mega Run” – Here’s The Target,"Crypto analyst Crypto Patel has predicted a parabolic rally for the Dogecoin price to reach as high as $5. This comes as DOGE struggles to reclaim the psychological $0.2 level, sparking bearish sentiments for the foremost meme coin.  Dogecoin Price Eyes Histo…",http://www.newsbtc.com/news/dogecoin/dogecoin-historic-mega-run/,2025-11-13T12:30:06Z
226,4,newsBTC,Jake Simmons,One Slip And Dogecoin Could Plunge Back Into A Bear Market: Analyst,"The Dogecoin multi-year recovery trend is under pressure as price slips below a key ascending support and rests on an historic horizontal level, according to a new chart from trader and analyst Rekt Capital. Dogecoin Is Inches Away From A Bear Market In an X …",http://www.newsbtc.com/news/dogecoin/dogecoin-plunge-into-bear-market/,2025-11-18T01:00:01Z
227,4,newsBTC,Scott Matherson,Analyst Highlights Interesting Dogecoin Double Top Adam & Eve Pattern,"Crypto analyst Tripy has highlighted a double-top Adam and Eve pattern that could send the Dogecoin price as low as $0.16. Meanwhile, crypto XAU has also highlighted a bearish setup that could spark a further decline to $0.15.  Dogecoin Price Risks Drop To $0…",http://www.newsbtc.com/news/dogecoin/dogecoin-adam-eve-pattern/,2025-11-14T18:00:03Z
228,4,newsBTC,Jake Simmons,Is The Dogecoin Bottom In? Analyst Explains What Matters Now,"Dogecoin is attempting to stabilize after a sharp shakeout, and one technician argues the market just telegraphed its line in the sand. In a weekly chart shared on X, independent analyst Kevin (@Kev_Capital_TA) highlights a “solid bounce” from the weekly 200-…",http://www.newsbtc.com/news/dogecoin/is-the-dogecoin-bottom-in-what-matters-now/,2025-11-11T12:00:37Z
229,4,newsBTC,Christian Encila,"Dogecoin Alert! Price Could Explode Over 2,800%, Analyst Says","According to market reports, crypto analyst Crypto Patel has put forward bold targets for Dogecoin, saying the memecoin could reach $2 and $5 this cycle. Related Reading: XRP Has Held Its Ground As Most Altcoins Fall, Market Observers Say At the time of his p…",http://www.newsbtc.com/dogecoin-2/dogecoin-alert-price-could-explode-over-2800-if-historical-patterns-repeat-analyst/,2025-11-13T05:00:39Z
230,4,newsBTC,Scott Matherson,The ‘Insanely Bullish’ Dogecoin Setup That Will Trigger A 600% Rally To $1,"Dogecoin has spent the past few days struggling to regain momentum after a series of pullbacks dragged the price back toward the mid-$0.16 region. The broader market has also been unstable, adding pressure to Dogecoin. Despite this stretch of bearish price ac…",http://www.newsbtc.com/news/dogecoin/insanely-bullish-dogecoin-setup/,2025-11-17T21:00:48Z
231,4,newsBTC,Jake Simmons,Dogecoin Shows Relative Strength: Breakout Signal Sits At This Price,"Dogecoin is showing unexpected resilience while the broader crypto market trades in a weak pattern, according to trader Daan Crypto Trades (@DaanCrypto). In a chart posted on X on November 13, he highlighted a potential “range retake” that could set up a move…",http://www.newsbtc.com/news/dogecoin/dogecoin-relative-strength-breakout-signal/,2025-11-14T20:00:11Z
232,4,newsBTC,Scott Matherson,"Dogecoin Price Set For 1,200% Rally To $2.2 In This 3rd Run","So far in history, the Dogecoin price has seen two major price rallies that have led the meme coin to reach brand new all-time highs. Given this trend, the expectations are that the cryptocurrency could be getting ready for another rally like the last two bea…",http://www.newsbtc.com/news/dogecoin/dogecoin-price-1200-rally-2-2/,2025-11-10T07:00:00Z
233,4,newsBTC,Scott Matherson,Dogecoin Price Could Surge Above $1 As It Repeats This Trend From 2023-2024,"The Dogecoin price may be poised for a significant rebound, as a familiar long-term pattern has emerged on its chart. According to technical analysis, the structure looks almost identical to a setup that triggered a major breakout in its previous cycle, from …",http://www.newsbtc.com/news/dogecoin/dogecoin-could-surge-above-1/,2025-11-19T22:00:28Z
234,4,newsBTC,Scott Matherson,Dogecoin Price Could Bounce Very Quickly If This Happens At $0.166,"The Dogecoin price has generally followed the trajectory of other altcoins relative to Bitcoin and has seen deeper declines compared to the pioneer cryptocurrency. These declines have left the leading meme coin by market cap in the red, pushing it back down t…",http://www.newsbtc.com/news/dogecoin/dogecoin-price-bounce-0-166/,2025-11-17T07:00:21Z
235,4,newsBTC,Scott Matherson,Dogecoin Price Rally Above $0.74 ATHs In The Works As HTF Trend Holds,Crypto analyst Balo has assured that the Dogecoin price rally to a new all-time high (ATH) above $0.74 is in the works. He explained why this rally may be closer than some may imagine despite the recent bearish price action.  Dogecoin Price Eyes Rally Above $…,http://www.newsbtc.com/news/dogecoin/dogecoin-to-rally-above-0-74/,2025-11-12T12:30:25Z
236,4,newsBTC,Jake Simmons,Dogecoin Breakdown Or Bottom? On-Chain Risk Hits Extreme Value Zone,"Dogecoin is sitting at an inflection point where weakening market structure meets unusually compressed on-chain risk, according to new charts shared by analyst Cryptollica (@Cryptollica). The visuals juxtapose a multi-year DOGE/USDT price channel with Alphafr…",http://www.newsbtc.com/news/dogecoin/dogecoin-on-chain-risk-extreme-value-zone/,2025-11-18T14:30:31Z
237,4,newsBTC,Scott Matherson,"Dogecoin Price Could See 4,440% Rally To $5 If This Macro Cycle Repeats","Crypto analyst Bitcoinsensus has predicted that the Dogecoin price could rally 4,400% to $5, a new all-time high (ATH) for the foremost meme coin. The analyst also revealed what needs to happen for DOGE to witness this parabolic rally.  Dogecoin Price Eyes 4,…",http://www.newsbtc.com/news/dogecoin/dogecoin-could-see-4440-rally/,2025-11-10T16:00:34Z
238,4,Bitcoinist,Sandra White,"If The Dogecoin Price Successfully Breaks This Zone, Then Prepare For A Strong Upward Push","The Dogecoin price has spent the past few days attempting to recover from a decline that has affected the entire industry for weeks, shifting from a clear downtrend earlier in the month into a more constructive structure. After dipping below the $0.16 region,…",https://bitcoinist.com/dogecoin-price-upward-push/,2025-11-14T00:00:58Z
239,4,Bitcoinist,Jake Simmons,Grayscale Set To Debut First Spot Dogecoin ETF On Nov. 24: Bloomberg Expert,"Grayscale may launch the first US spot Dogecoin ETF as soon as November 24, according to Bloomberg Senior ETF analyst Eric Balchunas, in what would mark the meme coin’s formal entry into the mainstream US ETF arena. “Based on 20 day clock I believe Grayscale …",https://bitcoinist.com/grayscale-first-spot-dogecoin-etf-nov-24/,2025-11-18T11:00:27Z
240,4,newsBTC,Aaron Walker,Dogecoin ETF Launches Next Week as Maxi Doge Presale Breaks $4M,"What to Know: Grayscale’s Dogecoin ETF is likely to launch on November 24, marking a significant step for Dogecoin’s institutional acceptance. While not 100% confirmed, Eric Balchunas believes the chances of a November launch are very high, based on the Grays…",http://www.newsbtc.com/news/dogecoin-etf-maxi-doge-presale/,2025-11-18T09:12:59Z
241,4,newsBTC,Scott Matherson,"Why Are The Bitcoin, Ethereum, And Dogecoin Prices Down Again?","The cryptocurrency market is experiencing a wave of declines, leaving investors concerned as the Bitcoin, Ethereum, and Dogecoin prices fall sharply. Despite experiencing a period of recovery earlier this week, all three digital assets are now facing renewed …",http://www.newsbtc.com/news/bitcoin-ethereum-dogecoin-down/,2025-11-14T15:30:03Z
242,4,newsBTC,Aayush Jindal,"Dogecoin (DOGE) Weak Rebound Attempts, Signaling Struggle to Mount Recovery",Dogecoin started a fresh decline below the $0.180 zone against the US Dollar. DOGE is now correcting some losses and might face hurdles near $0.1650. DOGE price started a fresh decline below the $0.180 level. The price is trading below the $0.170 level and th…,http://www.newsbtc.com/analysis/doge/dogecoin-doge-weak-rebound-0-1650/,2025-11-17T05:08:43Z
243,4,Bitcoinist,Scott Matherson,Top Meme Coins Besides Dogecoin And Shiba Inu With Potential Still Seeing Major Interest,"Dogecoin and Shiba Inu have not seen the best performances over the last few years, but this has not deterred other meme coins from going on major rallies. The likes of PEPE and BONK have emerged with great potential, building strong communities and contendin…",https://bitcoinist.com/meme-coins-dogecoin-shiba-inu-2/,2025-11-14T15:00:02Z
244,4,International Business Times,Matt Emma,Andy DeFrancesco and the Rise of Tokenized Real-World Assets,"At its core, tokenization transforms physical or financial assets — such as exotic car, collectibles, real estate, art, sports teams or commodities like Gold and Silver — into digital tokens recorded on a blockchain.",https://www.ibtimes.com/andy-defrancesco-rise-tokenized-real-world-assets-3790291,2025-11-13T19:11:34Z
245,4,newsBTC,Jake Simmons,"Dogecoin Momentum Returns: $1 Target Back In Play, Says Analyst","Dogecoin’s technical momentum is “back in the conversation,” with a revived pathway to $1 if current conditions hold, according to crypto analyst VisionPulsed in a November 10 video breakdown focused on DOGE’s structure and momentum profile. While he repeated…",http://www.newsbtc.com/news/dogecoin/dogecoin-1-target-back-in-play/,2025-11-11T02:00:08Z
246,4,newsBTC,Scott Matherson,"Dogecoin Does Not Have Potential For A Strong Move Upward, Analyst Says","Following the general trend of the crypto market, the Dogecoin price has been stuck in sideways action for a while now. Mostly, there has been more dominance toward the downside compared to any opportunity for a recovery, and this has pushed it toward critica…",http://www.newsbtc.com/news/dogecoin/dogecoin-does-not-have-potential/,2025-11-11T11:00:40Z
247,4,Bitcoinist,Sandra White,20x In The Cards? Why Dogecoin Has The Potential To Run Again,"Dogecoin has spent the past week moving within a tight range, trading between $0.16 and $0.19 with the entire market maintaining a cautious tone. The price briefly dipped below $0.16 last week but was quickly met with buying interest, keeping the meme coin fr…",https://bitcoinist.com/20x-dogecoin-potential-run/,2025-11-11T17:30:21Z
248,4,Bitcoinist,Scott Matherson,"Analyst Suggests Selling Bitcoin To Buy Dogecoin, Here’s Why","Bitcoin’s latest pullback has created an unexpected opportunity in one corner of the market, and it is not coming from BTC itself. Attention has shifted to the DOGE/BTC trading pair, which has quietly returned to a major support zone that proposes the start o…",https://bitcoinist.com/sell-bitcoin-buy-dogecoin/,2025-11-19T05:00:28Z
